{
  "code": "NCA-ECC-2-2024", "regulator": "NCA", "name_ar": "الضوابط الأساسية للأمن السيبراني",
  "name_en": "Essential Cybersecurity Controls", "version": "2-2024", "status": "CONTENT_PENDING_VERIFICATION",
  "official_source": "https://nca.gov.sa/en/regulatory-documents/controls-list/ecc/", "facts": {}, "controls": []
}
