{
  "code": "ISO-27001-2022", "regulator": "ISO", "name_ar": "نظام إدارة أمن المعلومات",
  "name_en": "Information security management systems", "version": "2022", "status": "CONTENT_PENDING_VERIFICATION",
  "official_source": "https://www.iso.org/standard/27001", "facts": {"copyrighted_content_excluded": true}, "controls": []
}
