{
  "code": "SDAIA-PDPL", "regulator": "SDAIA", "name_ar": "نظام حماية البيانات الشخصية ولوائحه التنفيذية",
  "name_en": "Personal Data Protection Law and Implementing Regulations", "version": "current", "status": "VERIFIED_METADATA",
  "official_source": "https://sdaia.gov.sa/en/SDAIA/about/Pages/RegulationsAndPolicies.aspx", "facts": {}, "controls": []
}
